,url,post_time,title,content,watches,replies
0,http://cskaoyan.com/thread-661001-1-1.html,发表于 2020-10-18 17:58,"[python 1th] 二战失败,在王道的学习和找工作经历"," 本帖最后由 20201018 于 2020-10-18 18:10 编辑 先简单介绍下我的情况吧, 19年辞职考研, 20年年初去王道培训,现已入职自己心仪的公司,对目前的生活可以说是十分满意!!!!!一、为什么辞职考研?      其实毕业之后也是在一个二梯队的大厂,但是部门氛围比较压抑、一线城市压力大(主要是买不起房)、离家远, 每天就很抑郁,非常想回家,想转行.19年初下定了决心辞职考研(考的家附近学校,但是没考上), 因为考研的时候用的王道的书, 对王道的印象还不错, 就决定去王道培训一下(正好也因为疫情,没法出去找工作,当时觉得这个是后续找工作对于空窗期的一个很好的解释~~, 现在想想也感觉自己很机智)二、找工作经历分享      1. 写简历          推荐去 “乔布简历” 上下载简历模版          排版:                 如果你的学校好、年龄小、性别为女(好看的妹子如果能放上照片是最好的了), 最好把个人信息放在最前边                 项目经历最好遵守 “start 法则” 来写(自行百度这个法则), 会让面试官感觉你很专业, 增加对你工作经历的可信度      2. 投简历          第一阶段:                我是先海投, 有让我面试的我就去, 根据面试官的反馈来修改自己的简历, 然后总结一套属于自己的题库.(但是因为我没有包装自己的工作经验, 就直接把自己辞职考研这个事情挑明说了, 所以很多小厂并没有给我面试机会, 我这个计划执行到一半就放弃了)          第二阶段:                在 boss 上定向投, 这次直接全投大公司(因为在第一阶段的时候发现只有大公司不歧视我一年没上班, 所以就直接把小公司放弃了)  , 这个时候心态其实有些崩了, 面了好几个家, 都是到了 hr 面凉了(有几天晚上躺床上都在默默流泪) . 当时就劝自己, 再坚持找一个月的工作, 要是找不到, 就继续去考研.               每次面完都会和龙哥一起讨论面试题目, 讨论我哪里没有答好,哪里没有表现好(在这里要感谢龙哥, 每次都非常尽心尽力地帮我分析)          第三阶段:               经过第二阶段的痛苦, 这个时候我自己总结的题库已经很丰富了, 虽然还是没有 offer , 但是人变得自信了, 加上以前同事和大学同学帮忙内推, 终于有了 offer !三、如何准备面试以及如何整理面试题      简历上写的项目和技术首先是都要保证会的        1. 记笔记        把每次面试面试官问到的东西都分类整理出来, 推荐 bear 这个软件, 随时随地都能看, 在电脑上记, 在各个设备上都能同步, 可以在去面试的路上打开手机翻一翻, 晚上睡前翻一翻, 饭后散步翻一翻, 非常好用!             2. 做思维导图(龙哥上课的时候特别强调的, 自己按照自己的习惯来记, 我是按知识点来分类记的)                 3. 做面试总结            面试完, 趁着自己还能记住面试题, 就赶快用手边趁手的工具来把面试题记下来, 尤其是自己感觉没有回答好的 !            特别强调:               一定要和王道的老师一起来对自己的每一场面试做复盘, 这样才能知道自己哪里表现不好, 哪里还需要改进, 老师也能对你做对应的指导               一定要和王道的老师一起来对自己的每一场面试做复盘, 这样才能知道自己哪里表现不好, 哪里还需要改进, 老师也能对你做对应的指导               一定要和王道的老师一起来对自己的每一场面试做复盘, 这样才能知道自己哪里表现不好, 哪里还需要改进, 老师也能对你做对应的指导               一面面试官如果问你的问题没答上来, 二面面试官有可能还会接着问的(我就遇到过, 一面的时候我说我不会docker, 二面面试官就问我上次面试完之后有没有下去自己学, 幸好我学了, 要不然也会凉凉, 所以大家就算感觉自己面试过不了, 也要好好总结经验, 准备好下一场, 不会的东西及时学, 不要拖延!!)四、随便聊聊自己考研失败到现在的心路历程吧       考研失败的时候, 感觉自己的人生不知道该何去何从, 在王道学习的那段日子, 说实话也很焦虑(我本身也是个非常容易焦虑的人) , 班里的同学都是大佬, 为了不让自己那么焦虑, 只能逼自己每天按时交作业(这样就没时间乱想了), 后来发现越到后边, 能按时交作业的人越来越少了, 才慢慢找回来了点自信.        后来找工作, 我应该算是我们班开始找工作比较早的人吧(应该吧,焦虑的人就是这么心急), 其实找工作的过程还算顺利, 就是两三天会心态崩一次, 然后自我调节好, 再继续找, 找了差不多一个月吧, 就找到了自己很满意的工作(钱多、活少、离家近、城市房价也在自己承受范围内, 现在上了一段时间的班, 发现同事也都非常热情, 部门氛围超级棒!!!! 简直是我梦想中的工作了, 哈哈哈哈哈哈哈, 真的是超级满意, 偶尔还有自己配不上这个工作的错觉)          也祝大家能找到自己心仪的工作, 每天开开心心上班, 开开心心赚钱~~~          最后再说一句, 如果决定了要报王道训练营, 就一定要做好努力学习的准备(不要想着敷衍混日子), 一定要按时完成作业!! 只要能保证每天认真听课, 按时交作业, 那么你找工作肯定只没有任何问题的",897,1
1,http://cskaoyan.com/thread-661002-1-1.html,发表于 2020-10-19 11:25,出王道408四件套,21年的基本都全新有意的q: 1489494160,611,0
2,http://cskaoyan.com/thread-661003-1-1.html,发表于 2020-10-19 17:55,请教王道书算法题:合并两个有序单链表,"《王道数据结构2021》第二章2.3.7综合题 14题 题目:设A和B是两个单链表（带头结点），其中元素递增有序。设计一个算法从A和B中的公共元素产生单链表C，要求不破坏A、B的结点。自己手打的王道书参考代码如下(不含红圈部分):问题是输入有序表A={1,1,1,1}和B={1,1,1}是答案应该是C={1}才对, 而代码结果是{1,1,1}是不是题干说的有序表默认就是无重复元素的有序表?",755,1
3,http://cskaoyan.com/thread-661004-1-1.html,发表于 2020-10-19 20:30,汤子瀛操作系统配套辅导书的习题及答案,汤子瀛操作系统配套辅导书的习题,612,0
4,http://cskaoyan.com/thread-661005-1-1.html,发表于 2020-10-19 21:47,Java22期真菜鸡的转行之路,趁着今天有空，来回顾下培训的点点滴滴，与道友们分享下我的转行经验。我其实最开始报名的是20th，但是因为疫情身处湖北，电脑又不在身边，所以一直拖到了22th才开始正式的培训之旅。虽然是全线上课程，虽然我是文科专业专升本，但还是让我能够顺利地转行并成功拿到了offer，这都与王道诸位老师的悉心教学和密切关照是分不开的，下面我分享下我整个学期的经历。课程阶段：首先是se阶段，帅哥的详细是你在其他课程所见不到的，他真的很注重基础，争取让我们每个人都能听懂，也正是这样才能够帮我们为后面的课程打下了很好的基础。黑大帅的课程可能最开始有点懵，因为他这部分是我们以前没接触过的，ds啊，database啊，这些对于初学者来说确实很难，所以这阶段的话应该好好听，晚上好好回顾，不然的话第二天的课程就会跟不上；黑大帅属于那种干净利落，永不加班型的，跟他手撸数据结构，能够为我们对编程思想的理解有个质的提升，接下来白龙哥的前端阶段，感觉可能白龙哥以前应该是带过项目小组的那种全栈大佬，他对于一些我们初级Java小白的心理摸得透透的，我一直记得他说过，我们作为程序员，应该要有“敏感度”，对一些技术，应该去思考它们的用处，它们的原理，为什么它可以用在这，这些都需要我们去花时间思考，而不是只会在项目中使用，其他的就不管了，这样的话那么永远都只是个低级码农。接下来的是松哥的ee阶段，松哥属于那种比较严格的老师哈哈，我记得点我回答过一次问题，刚好走神了，挺尴尬的，他的风格其实和黑大帅一样，干净利落，也正是这个阶段我们就开始真正进入到项目阶段；spring阶段的石头哥，他的笔记方法，是我觉得最适合于我们这种实操课程教学的（虽然你用得很秀，但是下一秒就是我的了），哈哈，回顾的时候看下自己截的图片，一下子就能知道这里在讲什么了，不用再去回顾视频，简直太棒了；最后阶段雪茄哥的课程，其实也是非常非常重要的，因为这个阶段的课程是我们面试时碰到的非常多的部分，所以一定要好好学，一定要好好去了解一下每个中间件的实现方式，这些面试中都会问，最后一个项目一定要好好吃透，这就是你面试时候的资本，某种程度上，这部分掌握得好与坏，直接决定你的薪资。就业阶段：因为我的面试是分两个阶段，前半个月在武汉面的，后半个月来杭州面的，拿了杭州的9*13k，五险一金的offer，最后综合考虑接了这个offer，下面来为大家分享下我这一个月的面试经验。0 关于简历不擅长的部分不要写，简历就是你面试的主目录非科班注意：在简历学校下方尽量写点自己大学自学的cs课程或者cs考研（如果有）的经历，容易收获更多邀请注意工作年限，如果是去年毕业也可以加个实习经验（根据个人情况）一定要大量投递，投递越多，机会越多boss>拉钩>其他1 关于面试准备自己根据项目代码使用作图软件梳理项目流程，推荐WPS的画图功能准备的内容必须是自己消化过的，切勿照搬照抄，不熟的部分需要多花时间去看，成为自己的东西边面试边准备，不要想先准备好了完整的面试题再去投，先求精，再求全而精。不要想你准备的他都会问，核心在于如何在把你会的都展示好，不会的能够随机应变给项目准备个亮点，可以自己去找（类似我们项目的pipeline管道模式），这都是套路2 关于面试尽量能现场面就不要电话面，考察维度不同先投不想去的公司练手记录面试问题外包偏容易，小厂大多偏难（问题广，还喜欢刨根问底）面试官大体分两种：答上了换题目型：这种面试官比较佛系，放平心态，尽量多说说你会的，不会的话别尬住，他们可能不会打断你答上了刨根问底型：这种面试官需要注意，不要不懂装懂，不然容易凉，碰到不会的尽量把话题绕开。实在绕不开的就甩锅踩坑点：面试官问你期望薪资时，一定要根据多个维度（城市，工作年限，学校，专业，面试表现等等）综合评估你的薪资，不要太离谱，如果和你的真实实力不符，就会被pass。但是注意，最后和hr谈的时候可不要手软，这两个薪资可以不同，hr必定会压价的3 关于心态面试心态初期有波动，面到后面发现问的问题大抵就那么多，也就不会再有心态的问题，不要过分关注情绪上的波动，动起手投简历或者复习知识遇到各种问题不要气馁，遇到问题解决问题，一定要和组员老师沟通，沟通一定会有收获运气其实占大概百分之30，所以，多投多面，你这场不会的问题，下场不一定会被问到，不要被吓到把握好自己的面试节奏，根据个人的情况，稳扎稳打，不要被一家拒绝了后就否定自己很惭愧，做了一点微小的工作给各位道友，各位道友如果觉得有帮助的话可以参考下，希望大家能够按照自己的实际情况分析现在的进度，早日收获到自己满意的offer！！,762,0
5,http://cskaoyan.com/thread-661006-1-1.html,发表于 2020-10-19 22:16,哈工大复试C语言用书是第几版,复试C语言的书是苏小红老师的第几版的，需要买那本学习指导吗,496,1
6,http://cskaoyan.com/thread-661007-1-1.html,发表于 2020-10-19 22:59,有人想考837吗,求问有人想考哈工大网安方向吗（考试代码837） 想交流下复习经验与求复习资料,647,2
7,http://cskaoyan.com/thread-661009-1-1.html,发表于 2020-10-20 09:16,王道开启了我的新生活（风华注：二跨失败、短期班、Java线上班、七面终入大厂）！,选择我本科就读于华南理工大学能源与动力工程，但是一直提不起对这个专业的兴趣，对毕业后的可以入职的那些公司也不满意。那时候也和女朋友商量过未来，她建议我学习金融或者计算机，那时也没有考虑多久，倾听内心的声音，我还是对计算机更感兴趣。当时还是大三，想着先考计算机的研究生吧，因为自己是零基础，就直接买了408对应科目的教材，先在校图书馆自学了c语言，然后看完了4本教材，但是因为平常要上课，还有期末考试什么的，导致我不能专心的投入备考中。9月份我才看完那4本教材，然后就问之前考研成功的师兄师姐，他们给我推荐了王道的考研书，也就是那时接触到了王道。直到考试前，我只刷完了选择题，所以没考上是注定的。第二年考研自己租了一个单间备考，也没找一个一起学习的伙伴互相监督，到后来几个月松懈了，有些没有动力，虽然坚持下来了，但是成绩还是不理想，没考上。等待考研成绩出来的期间，我报名参加了王道的c/linux短期班，班里的同学都好拼啊，那时候的日子是那种每天睡觉都很满足很安心的感觉，因为自己一整天都很努力的学习。龙哥风趣幽默的讲课让我学到不少知识，龙哥从早上上课一直到晚上10点自习下了一直在教室，让我感受到王道老师的尽职尽责，还记得龙哥感冒了哑着嗓子讲课，是最让我感动的，当时心里就想，老师都这么拼命，我怎么可以咸鱼，其他同学也都是一样的，因为我清晰记得23：40之前，教室里的人就走了一两个。也是那之后，让我对计算机技术有了更深的理解。第二次考研失败之后，我的心情掉到了谷底，自从高考之后，我已经4，5年没有体会过成功的滋味了。成功的果实是我进步努力的动力，接连不断的失败让我对未来产生了迷茫。经过一段时间的调整，我觉得我又行了，既然是自己选择的路，就死磕到底。考研时就知道王道有面向就业的培训班，更何况之前自己上过一次，体验还很好，就再次选择了王道。今天坐在这里写经验帖给大家分享，也证明我之前的选择是对的，零基础的我，在王道学习之后，拿到了大厂的高新offer。成长由于疫情原因，我们这一期是4个多月的线上课程，学之前还会担心线上的效果不好，但是后来发现完全是我多虑了。早中晚的打卡方案让我成功的戒掉了睡懒觉的习惯。每个老师都很尽职尽责，我算是问题比较多的，每次晚上作业不会做了，都能及时得到老师的耐心解答，之前做项目的时候，松哥都是直接视频过来现场给我解决的，遇到bug不会解决本来就会急躁心烦，当时真是把我感动到了，这种解决了自己好久都不能自行解决的bug的开心，怕是只有程序员朋友可以感同身受了。四个月时间，我的心态都变好了，王道的老师们在讲课中，不仅讲授知识，还会分享一下他们的生活中的经验和建议，让我感受到不仅知识在涨，身心也在成长，抗压能力也在变强。面试过程我是性格比较急的那种，第一版简历通过后，我看问题不大，需要修改的地方不多，我就直接投了。刚开始刚学完，之前的知识都还没复习，所以约到几个面试，都以失败告终。在面试中，我都记得面试官问我的我不会的问题，自己回来都查了，那时候面试约的多，时间紧迫，学习时间少，但是很出乎意料，那时感觉自己大脑特别活跃，看过的东西记得特别清晰，所以期间自己的知识储备没少提升。为了给自己点信心，面了个银行外包，结果很轻松就过 了，第二天就收到了offer，但是只给11k，当时因为失败4次，所以还是有点心动了。但是冷静下来，觉得自己能力不止于此，就推掉了。这之后一天，突然大厂联系我，说有意去他们公司吗，我心想，你敢让我去试，我怕啥，那时是抱着看看大厂面试是什么样的想法去的，压根就没想过可以进去。第一面是现场资格面试，通过之一面，才有资格去线下参加整个面试流程，面试官在面试我的同时，还面试了好几个人。问了一道算法题，我答出一种方法，我听其他人都不会，面试官又让我答一种时间复杂度更低的，我只说了思路，当时不会，后来上网查还蛮难的。可能因为比当时面试的其他人强一点，这面就过了。第二面是笔试，现场去了又四五十个人，笔试一个小时，笔试完面试官会根据笔试情况来选择是否进行初试，hr通知了四五个人，都背着书包走了，看样子是笔试没过，当时我很慌，因为我是倒数几个被叫到的。虽然没期待能过，但是来了就不想失败，想着被pass也是自己尽全力之后被pass。等了很久最后还是通过了。第三面，未来同事面试，面试官把我的笔试题挨着问了一遍，因为是大家一起笔试的，这么问也是防止作弊吧。因为大厂很看重算法，我三道算法题都做出来了，也算是一点优势吧。有一道题我说了三种方法，面试官很满意，那些也是我考研时学到的，第一次觉得考研没白考，总算用上了。之后还聊了一些技术栈，问的不是很深，我都答上来了，所以这面也过了。第四面，总监面试，这面问了我项目的技术架构，还有平时如何保证自己的代码正确性，有无和同时codeReview，如何分库分表等。这些我答的不是很好，架构的部分我了解的不深。还问了我两道算法题，为了达到她说的要求，数据结构要自己设计，我说了自己的想法，大致对了，最后讲了GC，jvm，这是我了解比较深的，她没有难倒我。但是前面答的很不好，我心都凉了，觉得铁定挂了。下楼等hr通知，心里已经做好了背包走人的准备。Hr却通知我过了，我当时很开心。第五面，技术总监面试，这面是让我压力最大的一面，现在想起来还很害怕，面试官迟到10多分钟才来，电话面试。刚开始问我几个问题就把我整懵了，面试官就直接叹气，我瞬间压力很大，因为感觉到自己让他失望了。问我最近学什么新东西了吗，我说最近简历投的多，看很多公司都要求掌握springcloud，我就学了一下，他就直接说，你学习就是为了面试吗。哇，这么直接，语气是那么硬，让我当场满脸问号，但是我又不能表现出来，我就耐心的解释了，因为它重要我才去学，因为是新的技术应用的多，我才想去了解，不被时代淘汰。接着他又问，那你和我讲讲springcloud吧，但是才看了3天不到，我说我才学到hystrix，知道服务降级限流熔断什么的，然后面试官又长叹一口气，感觉他超级失望，我压力也更大了，又问了其他一些不是java的问题，我还是不会，他再次叹气，一场面试叹气了十几次，我真的觉得自己是个啥也不会了菜鸟了，当时心里就想着完了。好在最后面试官问了我类加载过程，jvm调优，GC，我全部答上来了，直到最后，他开始不耐烦了，面试完也没问我有什么想问他的，直接说，先这样吧，面试结束。电话挂断后，我一个人瘫坐在沙发上，自己告诉自己，没关系，尽力了，但是还是很难受，觉得自己和大厂的要求差太远了，自己怎么这么菜，思考人生一个多小时，慢悠悠的走回了宿舍，当晚振作起来又投了很多公司。第二天中午，收到了面试通过的信息，很吃惊。后来才了解到，面试官是怎么测试你的抗压能力的，原来我的反应早在他们的掌握之中。第六面招聘经理面试，这一面就舒服多了，感觉已经是在走流程了，给我个高并发场景让我说多线程的处理方法，还有一道设计数据结构的问题，整场面试十分钟不到。第七面，hr面试，问了天下hr都会问的问题，因为我健身5年，刚好hr也爱健身，面试一共30分钟，健身就聊了20分钟。面试特点1、流程长，整个面试我从9月4号开始到10月19号整个流程结束，除了现场3面，其余面试之间相隔最少一周时间。2、重视算法和数据结构3、重视底层原理4、重视学习能力，抗压能力个人面试技巧经验分享1、面试官迟到正常，不要在面试中体现出对他的不满2、不会的问题可以说说自己的想法，大致思路正确是加分项3、准备一两个杀手锏，可以和面试官深入沟通的那种重要提示大厂对学历要求还是很高的，学历问题可能会导致简历被pass。算法和数据结构的要求也很高，还有部门的缺人程度也决定了面试的难度，之前我也有了解到技术过关，但是和技术总监没有眼缘被刷的，感觉也是个运气活儿。最主要还是面试流程长，不能保证自己每面都过，看到同学们拿到offer，自己的压力和焦虑感也会加重，而且如果中间的面试挂了，可能两三个星期就白忙活了。希望大家投大厂之前，对自己的承受能力，还有其他硬性要求做好评估，不要盲目做事。当然，希望大家都顺利，早日找到自己心仪的工作。,1123,4
